{
 "format": "schemalyser-question/1",
 "title": "Red cells given to neonates under anaesthesia",
 "contract_version": "1.1",
 "statement": {
  "cohort": "Every anaesthetic of a child under 28 days old at its start, leaving out test patients.",
  "outcome": "The volume of red cells charted during the anaesthetic, in millilitres.",
  "result": "One row with the number of anaesthetics and the total millilitres of red cells."
 },
 "decisions": [
  {
   "about": "who is a neonate",
   "choice": "under 28 days at the start",
   "value": 28,
   "unit": "days",
   "decision": "A neonate is under 28 days old at the start of the anaesthetic, counted by calendar date.",
   "by": "dr@example.test",
   "date": "2026-10-14"
  },
  {
   "about": "which patients are left out",
   "choice": "test patients",
   "value": [
    "test_patient"
   ],
   "decision": "Test patients are left out.",
   "by": "dr@example.test",
   "date": "2026-10-14"
  }
 ],
 "capabilities": [],
 "question_sql": "WITH neonatal AS (SELECT a.anaesthetic_key FROM role_anaesthetic a JOIN role_patient p ON p.patient_key = a.patient_key WHERE p.is_test = 0 AND DATEDIFF(day, p.birth_date, a.start_time) < 28)\nSELECT COUNT(*) AS anaesthetics, SUM(f.volume_ml) AS red_cells_ml FROM neonatal n JOIN role_fluid f ON f.anaesthetic_key = n.anaesthetic_key WHERE f.kind = 'red_cells'",
 "parts": [
  {
   "name": "role_anaesthetic",
   "version": 1,
   "admission": "admitted"
  },
  {
   "name": "role_fluid",
   "version": 1,
   "admission": "admitted with a ceiling"
  },
  {
   "name": "role_patient",
   "version": 1,
   "admission": "admitted"
  }
 ],
 "proposals": [],
 "approval": {
  "reference": "QA-2026-014",
  "use": "audit"
 },
 "note": "Counts and volumes only.",
 "produced": {
  "model": "fake",
  "at": "2026-10-14T09:00:00Z",
  "by": "dr@example.test"
 }
}
